{
  "schema_version": "pid.graph.v0.1.1",
  "metadata": {
    "doc_id": "100478CP-N-PG-PP01-PR-PID-0008-001",
    "rev": "C02",
    "rev_date": "2016-09-01",
    "sheet_no": "01/01",
    "status": "existing",
    "plant": "Early Power Plant - Rumaila Oil Field",
    "unit": "PP01",
    "units": {
      "pressure": "bar(g)",
      "temperature": "degC",
      "length": "mm",
      "diameter": "in"
    }
  },
  "nodes": [
    {
      "id": "eq:PP01-362-V-01",
      "type": "equipment",
      "subtype": "vessel.knockout_drum",
      "tag": "PP01-362-V-01",
      "layer": "process",
      "service": "Fuel Gas Knockout Drum",
      "props": {
        "name": "Fuel Gas Knockout Drum",
        "dimensions": { "id_mm": 2200, "length_tt_mm": 5500 },
        "design_pressure_bar_g": 14,
        "operating_pressure_bar_g": "9-10.4",
        "operating_temperature_C": "23-72",
        "material": "Carbon Steel",
        "corrosion_allowance_mm": 3,
        "internal_coating": "Epoxy Ceramic Coating",
        "insulation": "None",
        "trim_number": "PP01 362 V1 TX1 V 03 F9"
      }
    },

    { "id": "noz:N1", "type": "nozzle", "tag": "N1", "layer": "process", "service": "PSV header / relief to HP flare", "props": { "size_in": 14 } },
    { "id": "noz:N2", "type": "nozzle", "tag": "N2", "layer": "process", "service": "Gas outlet / header to treatment and flare", "props": { "size_in": 16 } },
    { "id": "noz:N3", "type": "nozzle", "tag": "N3", "layer": "process", "service": "Condensed liquid outlet to condensate storage", "props": { "size_in": 4 } },
    { "id": "noz:N4", "type": "nozzle", "tag": "N4", "layer": "process", "service": "Fuel gas inlet from DS3 scraper receiver", "props": { "size_in": 12 } },
    { "id": "noz:N5", "type": "nozzle", "tag": "N5", "layer": "process", "service": "Fuel gas inlet from DS1 scraper receiver", "props": { "size_in": 12 } },
    { "id": "noz:N8", "type": "nozzle", "tag": "N8", "layer": "process", "service": "Maintenance/service connection", "props": { "size_in": 3 } },
    { "id": "noz:N9", "type": "nozzle", "tag": "N9", "layer": "process", "service": "Manual drain to UC", "props": { "size_in": 2 } },
    { "id": "noz:N13", "type": "nozzle", "tag": "N13", "layer": "instrument", "service": "Pressure tapping A", "props": { "size_in": 2 } },
    { "id": "noz:N14", "type": "nozzle", "tag": "N14", "layer": "instrument", "service": "Pressure tapping B", "props": { "size_in": 2 } },
    { "id": "noz:N15", "type": "nozzle", "tag": "N15", "layer": "instrument", "service": "Pressure tapping C", "props": { "size_in": 2 } },
    { "id": "noz:N16", "type": "nozzle", "tag": "N16", "layer": "instrument", "service": "Pressure control tapping", "props": { "size_in": 2 } },
    { "id": "noz:N17", "type": "nozzle", "tag": "N17", "layer": "process", "service": "Vent/manway/service connection", "props": { "size_in": 3 } },

    { "id": "term:DS1_scraper_receiver", "type": "terminator", "subtype": "offpage", "tag": "DS1 Scraper Receiver", "layer": "process", "off_page_ref": "DS1_SCRAPER_RX" },
    { "id": "term:DS3_scraper_receiver", "type": "terminator", "subtype": "offpage", "tag": "DS3 Scraper Receiver", "layer": "process", "off_page_ref": "DS3_SCRAPER_RX" },
    { "id": "term:fuel_gas_treatment", "type": "terminator", "subtype": "offpage", "tag": "Fuel Gas Treatment Package", "layer": "process", "off_page_ref": "FG_TREATMENT_PKG" },
    { "id": "term:hp_flare_header", "type": "terminator", "subtype": "offpage", "tag": "HP Flare Header", "layer": "process", "off_page_ref": "HP_FLARE_HEADER" },
    { "id": "term:condensate_storage", "type": "terminator", "subtype": "offpage", "tag": "Condensate Storage Vessel", "layer": "process", "off_page_ref": "COND_STORAGE_VSL" },
    { "id": "term:UC", "type": "terminator", "subtype": "utility", "tag": "UC", "layer": "utility", "props": { "description": "Bucket/pit drain" } },

    { "id": "j:in1_red", "type": "junction", "subtype": "reducer", "layer": "process", "props": { "from_in": 16, "to_in": 12 } },
    { "id": "j:in2_red", "type": "junction", "subtype": "reducer", "layer": "process", "props": { "from_in": 16, "to_in": 12 } },

    { "id": "j:out_hdr", "type": "junction", "subtype": "tee", "layer": "process", "props": { "role": "N2 outlet header split" } },
    { "id": "j:bd_red", "type": "junction", "subtype": "reducer", "layer": "process", "props": { "from_in": 6, "to_in": 8 } },
    { "id": "j:pc_red", "type": "junction", "subtype": "reducer", "layer": "process", "props": { "from_in": 8, "to_in": 10 } },

    { "id": "j:psv_hdr", "type": "junction", "subtype": "header", "layer": "process", "props": { "role": "PSV header from N1" } },
    { "id": "j:psv1_in_red", "type": "junction", "subtype": "reducer", "layer": "process", "props": { "from_in": 14, "to_in": 8 } },
    { "id": "j:psv1_out_red", "type": "junction", "subtype": "reducer", "layer": "process", "props": { "from_in": 10, "to_in": 16 } },
    { "id": "j:psv2_in_red", "type": "junction", "subtype": "reducer", "layer": "process", "props": { "from_in": 14, "to_in": 8 } },
    { "id": "j:psv2_out_red", "type": "junction", "subtype": "reducer", "layer": "process", "props": { "from_in": 10, "to_in": 16 } },

    { "id": "j:liq_hdr", "type": "junction", "subtype": "tee", "layer": "process", "props": { "role": "N3 liquid outlet + bypass tie-in" } },
    { "id": "j:liq_lf_red1", "type": "junction", "subtype": "reducer", "layer": "process", "props": { "from_in": 2, "to_in": 1.5 } },
    { "id": "j:liq_lf_red2", "type": "junction", "subtype": "reducer", "layer": "process", "props": { "from_in": 1.5, "to_in": 4 } },
    { "id": "j:uc_red", "type": "junction", "subtype": "reducer", "layer": "utility", "props": { "from_in": 2, "to_in": 0.5 } },

    { "id": "val:IN1_CV", "type": "valve", "subtype": "check", "tag": "IN1-CV", "layer": "process", "props": { "size_in": 16 } },
    { "id": "val:IN1_HV", "type": "valve", "subtype": "ball", "tag": "IN1-HV", "layer": "process", "props": { "size_in": 16 } },
    { "id": "val:IN2_CV", "type": "valve", "subtype": "check", "tag": "IN2-CV", "layer": "process", "props": { "size_in": 16 } },
    { "id": "val:IN2_HV", "type": "valve", "subtype": "ball", "tag": "IN2-HV", "layer": "process", "props": { "size_in": 16 } },

    { "id": "val:HV061", "type": "valve", "subtype": "ball", "tag": "HV061", "layer": "process", "props": { "size_in": 6 } },
    { "id": "val:BDZV-01", "type": "valve", "subtype": "control", "tag": "BDZV-01", "layer": "process", "props": { "size_in": 6, "service": "blowdown" } },
    { "id": "val:HV029", "type": "valve", "subtype": "ball", "tag": "HV029", "layer": "process", "props": { "size_in": 8 } },

    { "id": "val:HV16", "type": "valve", "subtype": "ball", "tag": "HV16", "layer": "process", "props": { "size_in": 8 } },
    { "id": "val:PV02", "type": "valve", "subtype": "control", "tag": "PV02", "layer": "process", "props": { "size_in": 8, "service": "pressure control to flare" } },
    { "id": "val:HV21", "type": "valve", "subtype": "ball", "tag": "HV21", "layer": "process", "props": { "size_in": 10 } },
    { "id": "val:HV18", "type": "valve", "subtype": "ball", "tag": "HV18", "layer": "process", "props": { "size_in": 4, "role": "PV02 bypass" } },
    { "id": "val:HV0019", "type": "valve", "subtype": "globe", "tag": "HV0019", "layer": "process", "props": { "size_in": 4, "role": "PV02 bypass" } },
    { "id": "val:HV17", "type": "valve", "subtype": "drain", "tag": "HV17", "layer": "process", "props": { "size_in": 1 } },
    { "id": "val:HV20", "type": "valve", "subtype": "drain", "tag": "HV20", "layer": "process", "props": { "size_in": 1 } },

    { "id": "val:HV27", "type": "valve", "subtype": "gate", "tag": "HV27", "layer": "process", "props": { "size_in": 4 } },
    { "id": "val:EZV01", "type": "valve", "subtype": "control", "tag": "EZV01", "layer": "process", "props": { "size_in": 4, "service": "liquid drain control" } },
    { "id": "val:HV28", "type": "valve", "subtype": "gate", "tag": "HV28", "layer": "process", "props": { "size_in": 4 } },

    { "id": "val:HV32", "type": "valve", "subtype": "gate", "tag": "HV32", "layer": "process", "props": { "size_in": 2, "role": "liquid bypass" } },
    { "id": "val:HV004", "type": "valve", "subtype": "ball", "tag": "HV004", "layer": "process", "props": { "size_in": 1.5 } },
    { "id": "val:HV29", "type": "valve", "subtype": "isolation", "tag": "HV29", "layer": "process", "props": { "size_in": 1.5 } },
    { "id": "val:LV01", "type": "valve", "subtype": "control", "tag": "LV01", "layer": "process", "props": { "size_in": 1.5, "service": "low-flow / level control bypass" } },
    { "id": "val:HV30", "type": "valve", "subtype": "isolation", "tag": "HV30", "layer": "process", "props": { "size_in": 1.5 } },

    { "id": "ins:CIT-01", "type": "instrument", "subtype": "transmitter.conductivity", "tag": "CIT-01", "layer": "instrument", "props": { "mount": "2in blind branch on N3 outlet" } },

    { "id": "val:HV02", "type": "valve", "subtype": "gate", "tag": "HV02", "layer": "utility", "props": { "size_in": 2 } },
    { "id": "val:HV01", "type": "valve", "subtype": "check", "tag": "HV01", "layer": "utility", "props": { "size_in": 2 } },
    { "id": "val:HV51_UC", "type": "valve", "subtype": "drain", "tag": "HV51", "layer": "utility", "props": { "size_in": 1, "location": "between HV02 and HV01", "tag_collision": true } },

    { "id": "val:HV0064", "type": "valve", "subtype": "gate", "tag": "HV0064", "layer": "process", "props": { "size_in": 3 } },
    { "id": "val:HV03", "type": "valve", "subtype": "ball", "tag": "HV03", "layer": "process", "props": { "size_in": 3 } },

    { "id": "val:HV04", "type": "valve", "subtype": "ball", "tag": "HV04", "layer": "process", "props": { "size_in": 14 } },
    { "id": "val:HV5", "type": "valve", "subtype": "drain", "tag": "HV5", "layer": "process", "props": { "size_in": 1 } },